,NULL
NULL,"[('commencement of arbitral proceedings', 'this power includes the power\nto determine the admissibility, relevance, the materiality and weight of any evidence. sections 20, 21\nand 22 deal with place of arbitration, E17 and language\nrespectively. thereafter, sections 23, 24 and 25 deal with statements of claim and defence, hearings\nand written proceedings and procedure to be followed in case of default of a party.'), ('oral hearings', 'at this stage, we would refer to section 24 which is as under:-\n""24. hearings and written proceedings- (1) unless otherwise agreed by the parties,\nthe arbitral tribunal shall decide whether to hold E16 for the presentation of\nevidence or for oral argument, or whether the proceedings shall be conducted on the\nbasis of documents and other materials;\nprovided that the arbitral tribunal shall hold E16, at an appropriate stage of\nthe proceedings, on a request by a party, unless the parties have agreed that no oral\nhearing shall be held. (2) the parties shall be given sufficient advance notice of any hearing and of any\nmeeting of the arbitral tribunal for the purposes of inspection of documents, goods or\nother property.'), ('oral hearings', 'at this stage, we would refer to section 24 which is as under:-\n""24. hearings and written proceedings- (1) unless otherwise agreed by the parties,\nthe arbitral tribunal shall decide whether to hold E16 for the presentation of\nevidence or for oral argument, or whether the proceedings shall be conducted on the\nbasis of documents and other materials;\nprovided that the arbitral tribunal shall hold E16, at an appropriate stage of\nthe proceedings, on a request by a party, unless the parties have agreed that no oral\nhearing shall be held. (2) the parties shall be given sufficient advance notice of any hearing and of any\nmeeting of the arbitral tribunal for the purposes of inspection of documents, goods or\nother property.'), ('oral hearings', 'hearings and written proceedings- (1) unless otherwise agreed by the parties,\nthe arbitral tribunal shall decide whether to hold E16 for the presentation of\nevidence or for oral argument, or whether the proceedings shall be conducted on the\nbasis of documents and other materials;\nprovided that the arbitral tribunal shall hold E16, at an appropriate stage of\nthe proceedings, on a request by a party, unless the parties have agreed that no oral\nhearing shall be held. (2) the parties shall be given sufficient advance notice of any hearing and of any\nmeeting of the arbitral tribunal for the purposes of inspection of documents, goods or\nother property. (3) all statements, documents or other information supplied to, or applications made\nto the arbitral tribunal by one party shall be communicated to the other party, and\nany expert report or evidentiary document on which the arbitral tribunal may rely in\nmaking its decision shall be communicated to the parties.""'), ('oral hearings', 'hearings and written proceedings- (1) unless otherwise agreed by the parties,\nthe arbitral tribunal shall decide whether to hold E16 for the presentation of\nevidence or for oral argument, or whether the proceedings shall be conducted on the\nbasis of documents and other materials;\nprovided that the arbitral tribunal shall hold E16, at an appropriate stage of\nthe proceedings, on a request by a party, unless the parties have agreed that no oral\nhearing shall be held. (2) the parties shall be given sufficient advance notice of any hearing and of any\nmeeting of the arbitral tribunal for the purposes of inspection of documents, goods or\nother property. (3) all statements, documents or other information supplied to, or applications made\nto the arbitral tribunal by one party shall be communicated to the other party, and\nany expert report or evidentiary document on which the arbitral tribunal may rely in\nmaking its decision shall be communicated to the parties.""'), ('shortage of casing pipes', 'with\nregard to other contention on the basis of customs duty also, the arbitral tribunal\narrived at the conclusion that it would not justify the delay in the supply of goods. thereafter, the arbitral tribunal considered various decisions of this court regarding\nrecovery of liquidated damages and arrived at the conclusion that it was for the\nappellant to establish that they had suffered any loss because of the breach\ncommitted by the respondent in not supplying the goods within the prescribed time\nlimit. the arbitral tribunal thereafter appreciated the evidence and arrived at the\nconclusion that in view of the statement volunteered by mr. arumoy das, it was clear\nthat E10 was only one of the other reasons which led to the\nchange in the deployment plan and that it has failed to establish its case that it has\nsuffered any loss in terms of money because of E11 under the\ncontract.'), ('delay in supply of goods', 'with\nregard to other contention on the basis of customs duty also, the arbitral tribunal\narrived at the conclusion that it would not justify the delay in the supply of goods. thereafter, the arbitral tribunal considered various decisions of this court regarding\nrecovery of liquidated damages and arrived at the conclusion that it was for the\nappellant to establish that they had suffered any loss because of the breach\ncommitted by the respondent in not supplying the goods within the prescribed time\nlimit. the arbitral tribunal thereafter appreciated the evidence and arrived at the\nconclusion that in view of the statement volunteered by mr. arumoy das, it was clear\nthat E10 was only one of the other reasons which led to the\nchange in the deployment plan and that it has failed to establish its case that it has\nsuffered any loss in terms of money because of E11 under the\ncontract.'), ('shortage of casing pipes', 'thereafter, the arbitral tribunal considered various decisions of this court regarding\nrecovery of liquidated damages and arrived at the conclusion that it was for the\nappellant to establish that they had suffered any loss because of the breach\ncommitted by the respondent in not supplying the goods within the prescribed time\nlimit. the arbitral tribunal thereafter appreciated the evidence and arrived at the\nconclusion that in view of the statement volunteered by mr. arumoy das, it was clear\nthat E10 was only one of the other reasons which led to the\nchange in the deployment plan and that it has failed to establish its case that it has\nsuffered any loss in terms of money because of E11 under the\ncontract. hence, the arbitral tribunal held that appellant has wrongfully withheld the\nagreed amount of us $ 3,04,970.20 and rs.15,75,559/- on account of customs duty,\nsales tax, freight charges deducted by way of liquidated damages.'), ('delay in supply of goods', 'thereafter, the arbitral tribunal considered various decisions of this court regarding\nrecovery of liquidated damages and arrived at the conclusion that it was for the\nappellant to establish that they had suffered any loss because of the breach\ncommitted by the respondent in not supplying the goods within the prescribed time\nlimit. the arbitral tribunal thereafter appreciated the evidence and arrived at the\nconclusion that in view of the statement volunteered by mr. arumoy das, it was clear\nthat E10 was only one of the other reasons which led to the\nchange in the deployment plan and that it has failed to establish its case that it has\nsuffered any loss in terms of money because of E11 under the\ncontract. hence, the arbitral tribunal held that appellant has wrongfully withheld the\nagreed amount of us $ 3,04,970.20 and rs.15,75,559/- on account of customs duty,\nsales tax, freight charges deducted by way of liquidated damages.'), ('delay in supply of goods', '{re:\nprovash chandra dalui and another v. biswanath banerjee and another [1989 supp\n(1) scc 487]}. therefore, when parties have expressly agreed that recovery from the contractor for\nbreach of the contract is pre-estimated genuine liquidated damages and is not by way\nof penalty duly agreed by the parties, there was no justifiable reason for the arbitral\ntribunal to arrive at a conclusion that still the purchaser should prove loss suffered by\nit because of E11 further, in arbitration proceedings, the arbitral tribunal is required to decide the\ndispute in accordance with the terms of the contract.'), ('delay in supply of goods', 'therefore, when parties have expressly agreed that recovery from the contractor for\nbreach of the contract is pre-estimated genuine liquidated damages and is not by way\nof penalty duly agreed by the parties, there was no justifiable reason for the arbitral\ntribunal to arrive at a conclusion that still the purchaser should prove loss suffered by\nit because of E11 further, in arbitration proceedings, the arbitral tribunal is required to decide the\ndispute in accordance with the terms of the contract. the agreement between the\nparties specifically provides that without prejudice to any other right or remedy if the\ncontractor fails to deliver the stores within the stipulated time, appellant will be\nentitled to recover from the contractor, as agreed, liquidated damages equivalent to\n1% of the contract price of the whole unit per week for such delay.'), ('shortage of casing pipes', 'the arbitral tribunal after\nconsidering the decisions rendered by this court in the cases of fateh chand, maula bux and\nrampur distillery (supra) arrived at the conclusion that ""in view of these three decisions of the\nsupreme court, it is clear that it was for the respondents to establish that they had suffered any loss\nbecause of the breach committed by the claimant in the supply of goods under the contract between\nthe parties after 14th november, 1996. in the words we have emphasized in maula bux decision, it is\nclear that if loss in terms of money can be determined, the party claiming the compensation \'must\nprove\' the loss suffered by him"".oil & natural gas corporation ltd vs saw pipes ltd on 17 april, 2003\nindian kanoon - http://indiankanoon.org/doc/919241/ 27thereafter the arbitral tribunal referred to the evidence and the following statement made by the\nwitness das:\n""the re-deployment plan was made keeping in mind several constraints including\nE10."" further, the arbitral tribunal came to the conclusion that under these circumstances, the shortage of\ncasing pipes of 26"" diameter and 30"" diameter pipes was not the only reason which led to\nredeployment of rig trident ii to platform b 121.'), ('shortage of casing pipes', 'in the words we have emphasized in maula bux decision, it is\nclear that if loss in terms of money can be determined, the party claiming the compensation \'must\nprove\' the loss suffered by him"".oil & natural gas corporation ltd vs saw pipes ltd on 17 april, 2003\nindian kanoon - http://indiankanoon.org/doc/919241/ 27thereafter the arbitral tribunal referred to the evidence and the following statement made by the\nwitness das:\n""the re-deployment plan was made keeping in mind several constraints including\nE10."" further, the arbitral tribunal came to the conclusion that under these circumstances, the shortage of\ncasing pipes of 26"" diameter and 30"" diameter pipes was not the only reason which led to\nredeployment of rig trident ii to platform b 121. the arbitral tribunal also appreciated the other\nevidence and held that the attempt on the part of the ongc to show that production of gas on\nplatform b 121 was delayed because of the late supply of goods by the claimant failed.'), ('delay in supply of goods', 'in response thereto, it was pointed out that it was not\nthe case of learned counsel mr. setalwad on behalf of the claimants that ""these stipulations in the\ncontract for deduction of liquidated damages was by way of penalty"". further, the arbitral tribunal\nobserved that in view of the decisions rendered in fateh chand and maula bux cases, ""all that we\nare required to consider is whether the respondents have established their case of actual loss in\nmoney terms because of the delay in the supply of the casing pipes under the contract between the\nparties"". finally, the arbitral tribunal held that as the appellant has failed to prove the loss suffered\nbecause of E11 as set out in the contract between the parties, it is required to\nrefund the amount deducted by way of liquidated damages from the specified amount payable to the\nrespondent.'), ('delay in supply of goods', 'further, the arbitral tribunal\nobserved that in view of the decisions rendered in fateh chand and maula bux cases, ""all that we\nare required to consider is whether the respondents have established their case of actual loss in\nmoney terms because of the delay in the supply of the casing pipes under the contract between the\nparties"". finally, the arbitral tribunal held that as the appellant has failed to prove the loss suffered\nbecause of E11 as set out in the contract between the parties, it is required to\nrefund the amount deducted by way of liquidated damages from the specified amount payable to the\nrespondent. it is apparent from the aforesaid reasoning recorded by the arbitral tribunal that it failed to consider\nsections 73 and 74 of the indian contract act and the ratio laid down in fateh chand\'s case (supra)\nwherein it is specifically held that jurisdiction of the court to award compensation in case of breach\nof contract is unqualified except as to the maximum stipulated; and compensation has to be\nreasonable.'), ('delay in supply of goods', ""finally, the arbitral tribunal held that as the appellant has failed to prove the loss suffered\nbecause of E11 as set out in the contract between the parties, it is required to\nrefund the amount deducted by way of liquidated damages from the specified amount payable to the\nrespondent. it is apparent from the aforesaid reasoning recorded by the arbitral tribunal that it failed to consider\nsections 73 and 74 of the indian contract act and the ratio laid down in fateh chand's case (supra)\nwherein it is specifically held that jurisdiction of the court to award compensation in case of breach\nof contract is unqualified except as to the maximum stipulated; and compensation has to be\nreasonable. under section 73, when a contract has been broken, the party who suffers by such\nbreach is entitled to receive compensation for any loss caused to him which the parties knew when\nthey made the contract to be likely to result from the breach of it.""), ('shortage of casing pipes', 'it is\nundoubtedly true that the witness has stated that redeployment plan was made keeping in mind\nseveral constraints including E10 arbitral tribunal, therefore, took into\nconsideration the aforesaid statement volunteered by the witness that E10 was\nonly one of the several reasons and not the only reason which led to change in deployment of plan or\nredeployment of rigs trident-ii platform b-121. in our view, in such a contract, it would be difficult\nto prove exact loss or damage which the parties suffer because of the breach thereof.'), ('shortage of casing pipes', 'it is\nundoubtedly true that the witness has stated that redeployment plan was made keeping in mind\nseveral constraints including E10 arbitral tribunal, therefore, took into\nconsideration the aforesaid statement volunteered by the witness that E10 was\nonly one of the several reasons and not the only reason which led to change in deployment of plan or\nredeployment of rigs trident-ii platform b-121. in our view, in such a contract, it would be difficult\nto prove exact loss or damage which the parties suffer because of the breach thereof.'), ('delay in supply of goods', ""as the award directing the appellant to refund the amount deducted is set aside, question of\ngranting interest on the same would not arise. still however, to demonstrate that the award passed\nby the arbitral tribunal is, on the face of it, erroneous with regard to grant of interest, we deal with\nthe same.oil & natural gas corporation ltd vs saw pipes ltd on 17 april, 2003\nindian kanoon - http://indiankanoon.org/doc/919241/ 30arbitral tribunal arrived at the conclusion that the appellant wrongfully withheld/deducted the\naggregate amount of us $ 3,04,970.20 on account of E11 and amount of\nrs.15,75,559/- on account of excise duty, sales tax, freight charges deducted as and by way of\nliquidated damages from the amount payable by the respondent and thereafter arrived at the\nconclusion that the said amount was deducted from undisputed invoice amount, therefore, the said\nclaim of the respondent cannot be held to be 'disputed claim'. it is apparent that the claim of the contractor to recover the said amount was disputed mainly\nbecause it was agreed term between the parties that in case of E11 appellant was\nentitled to recover damages at the rate as specified in the agreement.""), ('delay in supply of goods', ""as the award directing the appellant to refund the amount deducted is set aside, question of\ngranting interest on the same would not arise. still however, to demonstrate that the award passed\nby the arbitral tribunal is, on the face of it, erroneous with regard to grant of interest, we deal with\nthe same.oil & natural gas corporation ltd vs saw pipes ltd on 17 april, 2003\nindian kanoon - http://indiankanoon.org/doc/919241/ 30arbitral tribunal arrived at the conclusion that the appellant wrongfully withheld/deducted the\naggregate amount of us $ 3,04,970.20 on account of E11 and amount of\nrs.15,75,559/- on account of excise duty, sales tax, freight charges deducted as and by way of\nliquidated damages from the amount payable by the respondent and thereafter arrived at the\nconclusion that the said amount was deducted from undisputed invoice amount, therefore, the said\nclaim of the respondent cannot be held to be 'disputed claim'. it is apparent that the claim of the contractor to recover the said amount was disputed mainly\nbecause it was agreed term between the parties that in case of E11 appellant was\nentitled to recover damages at the rate as specified in the agreement."")]"
annum,[]
the date of the award,[]
p.a.,"[('shortage of casing pipes', 'the arbitral tribunal thereafter appreciated the evidence and arrived at the\nconclusion that in view of the statement volunteered by mr. arumoy das, it was clear\nthat E10 was only one of the other reasons which led to the\nchange in the deployment plan and that it has failed to establish its case that it has\nsuffered any loss in terms of money because of E11 under the\ncontract. hence, the arbitral tribunal held that appellant has wrongfully withheld the\nagreed amount of us $ 3,04,970.20 and rs.15,75,559/- on account of customs duty,\nsales tax, freight charges deducted by way of liquidated damages. the arbitral\ntribunal further held that the respondent was entitled to recover the said amount\nwith interest at the rate of 12 per cent T17'), ('delay in supply of goods', 'the arbitral tribunal thereafter appreciated the evidence and arrived at the\nconclusion that in view of the statement volunteered by mr. arumoy das, it was clear\nthat E10 was only one of the other reasons which led to the\nchange in the deployment plan and that it has failed to establish its case that it has\nsuffered any loss in terms of money because of E11 under the\ncontract. hence, the arbitral tribunal held that appellant has wrongfully withheld the\nagreed amount of us $ 3,04,970.20 and rs.15,75,559/- on account of customs duty,\nsales tax, freight charges deducted by way of liquidated damages. the arbitral\ntribunal further held that the respondent was entitled to recover the said amount\nwith interest at the rate of 12 per cent T17')]"
1.4.1997,[]
